{
  "contractVersion": "1.0.0",
  "status": "success",
  "failure": null,
  "envelope": {
    "inputKind": "raw-xml",
    "originalInput": "<?xml version=\"1.0\" encoding=\"UTF-8\"?>\n<PathOfBuilding formatHint=\"synthetic-proof\">\n  <Build targetVersion=\"3_0\" pobVersionHint=\"caller-must-not-infer\"/>\n  <Items activeItemSet=\"10\" useSecondWeaponSet=\"true\" mysteryAttr=\"retained\">\n    <Item id=\"1\" variant=\"2\">Rarity: Rare\nSolar Edge\nSynthetic Sword\nUnique ID: player-weapon-001\n{crafted}99% increased Light Radius<ModRange id=\"1\" range=\"9\"/></Item>\n    <Item id=\"2\">Rarity: Rare\nMirror Guard\nSynthetic Shield</Item>\n    <Item id=\"3\">Rarity: Rare\nFlight Thread\nSynthetic Quiver</Item>\n    <Item id=\"4\">Rarity: Rare\nBuried Spark\nSynthetic Abyss Jewel</Item>\n    <Item id=\"5\">Rarity: Rare\nTree Spark\nSynthetic Jewel</Item>\n    <Item id=\"6\">Rarity: Rare\nUnused Memory\nSynthetic Ring</Item>\n    <Item id=\"7\">Rarity: Unique\nEnmity's Embrace\nSynthetic Gloves\n+999% to Fire Resistance\nUnique ID: volatile-observed-001</Item>\n    <Item id=\"8\" futureItemAttribute=\"kept\">Rarity: Rare\nUnknown Child Holder<FutureItemChild source=\"proof\">opaque</FutureItemChild></Item>\n    <ItemSet id=\"10\" title=\"Player candidate\" useSecondWeaponSet=\"false\" futureSetAttribute=\"kept\">\n      <Slot name=\"Weapon 1\" itemId=\"1\" active=\"true\" itemPbURL=\"https://example.invalid/player\"/>\n      <Slot name=\"Weapon 2\" itemId=\"2\"/>\n      <Slot name=\"Weapon 1 Swap\" itemId=\"1\"/>\n      <Slot name=\"Weapon 2 Swap\" itemId=\"0\"/>\n      <Slot name=\"Boots\" itemId=\"0\"/>\n      <Slot name=\"Weapon 1 Abyssal Socket 1\" itemId=\"4\"/>\n      <Slot name=\"Weapon 1 Abyssal Socket 2\" itemId=\"0\"/>\n      <Slot name=\"Helmet Abyssal Socket 2\" itemId=\"4\"/>\n      <SocketIdURL nodeId=\"101\" name=\"Synthetic socket\" itemPbURL=\"https://example.invalid/socket\"/>\n      <FutureSetChild proof=\"true\">retained</FutureSetChild>\n    </ItemSet>\n    <ItemSet id=\"20\" title=\"Mercenary candidate\" useSecondWeaponSet=\"true\">\n      <Slot name=\"Weapon 1\" itemId=\"7\"/>\n      <Slot name=\"Weapon 2\" itemId=\"3\"/>\n      <Slot name=\"Weapon 1 Swap\" itemId=\"1\"/>\n      <Slot name=\"Weapon 2 Swap\" itemId=\"2\"/>\n    </ItemSet>\n    <ItemSet id=\"30\" title=\"Animate Guardian\" useSecondWeaponSet=\"false\">\n      <Slot name=\"Gloves\" itemId=\"7\"/>\n    </ItemSet>\n    <FutureItemsChild proof=\"true\">retained</FutureItemsChild>\n  </Items>\n  <Tree>\n    <Spec title=\"First\"><Sockets><Socket nodeId=\"1001\" itemId=\"5\"/><Socket nodeId=\"1002\" itemId=\"0\"/></Sockets></Spec>\n    <Spec title=\"Second\"><Sockets><Socket nodeId=\"2001\" itemId=\"5\"/></Sockets></Spec>\n  </Tree>\n  <Skills>\n    <SkillSet id=\"1\"><Skill><Gem skillMinionItemSet=\"20\" skillMinionItemSetCalcs=\"999\"/></Skill></SkillSet>\n  </Skills>\n  <FutureSection proof=\"true\"><Opaque>retained</Opaque></FutureSection>\n</PathOfBuilding>\n",
    "decodedXml": null,
    "normalizedShareCode": null,
    "hashes": [
      {
        "name": "original-input-sha256",
        "algorithm": "SHA-256",
        "byteDomain": "exact original input encoded as UTF-8",
        "digestHex": "94d7f233b338455ff186fc109a5a073426c58f68672180ec7b73f3e38e8b8417"
      },
      {
        "name": "xml-utf8-sha256",
        "algorithm": "SHA-256",
        "byteDomain": "exact accepted XML string encoded as UTF-8",
        "digestHex": "94d7f233b338455ff186fc109a5a073426c58f68672180ec7b73f3e38e8b8417"
      }
    ],
    "sizes": {
      "originalInputCharacters": 2641,
      "originalInputUtf8Bytes": 2641,
      "normalizedShareCodeCharacters": null,
      "decodedCompressedBytes": null,
      "xmlUtf8Bytes": 2641
    },
    "codecSteps": [
      "caller string encoded as UTF-8 for byte limits and hashes"
    ],
    "normalizations": [],
    "limits": {
      "maxShareCodeCharacters": 4000000,
      "maxDecodedCompressedBytes": 3000000,
      "maxDecompressedXmlBytes": 8000000,
      "maxRawXmlBytes": 8000000,
      "maxXmlDepth": 64,
      "maxXmlElements": 50000,
      "maxAttributesPerElement": 64,
      "maxTextBytesPerElement": 1000000,
      "maxReportEntries": 256,
      "decompressionChunkBytes": 16384
    },
    "implementationVersion": "pob-importer-python/0.1.0",
    "evidenceProfile": [
      {
        "sourceId": "pob-release-2-66-2",
        "revision": "b23da8f841e4b0bc167b0b4401ea002d7d45f807"
      },
      {
        "sourceId": "pob-dev-format-ef4c584",
        "revision": "ef4c5848fad33190f730cebaedff4b5831d0c88d"
      },
      {
        "sourceId": "pob-simplegraphic-codec-3b1a346",
        "revision": "3b1a3468223d0ebd4042d6ce76fc6144718ef79b"
      },
      {
        "sourceId": "pob-pre-itemsets-1-4-36",
        "revision": "69d4e4d4e4cfb82ccca0ebf609d6673e347a98dc"
      },
      {
        "sourceId": "pob-itemsets-1-4-37",
        "revision": "9f981583f7c721917124d604cddf0e8102e62714"
      }
    ],
    "suppliedProducingPobVersion": null
  },
  "sourceMetadata": {
    "producingPobVersion": null,
    "producingPobVersionSource": "unknown",
    "gameTargetVersion": {
      "state": "present",
      "value": "3_0",
      "sourcePointers": [
        "/PathOfBuilding[1]/Build[1]/@targetVersion"
      ]
    },
    "otherVersionLikeValues": [
      {
        "sourcePointer": "/PathOfBuilding[1]/Build[1]/@pobVersionHint",
        "attributeName": "pobVersionHint",
        "rawValue": "caller-must-not-infer"
      }
    ]
  },
  "document": {
    "rootName": "PathOfBuilding",
    "rootAttributes": [
      {
        "name": "formatHint",
        "value": "synthetic-proof"
      }
    ],
    "topLevelNodeInventory": [
      {
        "sourceOccurrenceIndex": 0,
        "name": "Build",
        "attributes": [
          {
            "name": "targetVersion",
            "value": "3_0"
          },
          {
            "name": "pobVersionHint",
            "value": "caller-must-not-infer"
          }
        ],
        "classification": "recognized",
        "sourcePointer": "/PathOfBuilding[1]/Build[1]"
      },
      {
        "sourceOccurrenceIndex": 1,
        "name": "Items",
        "attributes": [
          {
            "name": "activeItemSet",
            "value": "10"
          },
          {
            "name": "useSecondWeaponSet",
            "value": "true"
          },
          {
            "name": "mysteryAttr",
            "value": "retained"
          }
        ],
        "classification": "recognized",
        "sourcePointer": "/PathOfBuilding[1]/Items[1]"
      },
      {
        "sourceOccurrenceIndex": 2,
        "name": "Tree",
        "attributes": [],
        "classification": "recognized",
        "sourcePointer": "/PathOfBuilding[1]/Tree[1]"
      },
      {
        "sourceOccurrenceIndex": 3,
        "name": "Skills",
        "attributes": [],
        "classification": "recognized",
        "sourcePointer": "/PathOfBuilding[1]/Skills[1]"
      },
      {
        "sourceOccurrenceIndex": 4,
        "name": "FutureSection",
        "attributes": [
          {
            "name": "proof",
            "value": "true"
          }
        ],
        "classification": "unrecognized",
        "sourcePointer": "/PathOfBuilding[1]/FutureSection[1]"
      }
    ],
    "sourceTree": {
      "kind": "element",
      "name": "PathOfBuilding",
      "attributes": [
        {
          "name": "formatHint",
          "value": "synthetic-proof"
        }
      ],
      "children": [
        {
          "kind": "text",
          "value": "\n  "
        },
        {
          "kind": "element",
          "name": "Build",
          "attributes": [
            {
              "name": "targetVersion",
              "value": "3_0"
            },
            {
              "name": "pobVersionHint",
              "value": "caller-must-not-infer"
            }
          ],
          "children": []
        },
        {
          "kind": "text",
          "value": "\n  "
        },
        {
          "kind": "element",
          "name": "Items",
          "attributes": [
            {
              "name": "activeItemSet",
              "value": "10"
            },
            {
              "name": "useSecondWeaponSet",
              "value": "true"
            },
            {
              "name": "mysteryAttr",
              "value": "retained"
            }
          ],
          "children": [
            {
              "kind": "text",
              "value": "\n    "
            },
            {
              "kind": "element",
              "name": "Item",
              "attributes": [
                {
                  "name": "id",
                  "value": "1"
                },
                {
                  "name": "variant",
                  "value": "2"
                }
              ],
              "children": [
                {
                  "kind": "text",
                  "value": "Rarity: Rare\nSolar Edge\nSynthetic Sword\nUnique ID: player-weapon-001\n{crafted}99% increased Light Radius"
                },
                {
                  "kind": "element",
                  "name": "ModRange",
                  "attributes": [
                    {
                      "name": "id",
                      "value": "1"
                    },
                    {
                      "name": "range",
                      "value": "9"
                    }
                  ],
                  "children": []
                }
              ]
            },
            {
              "kind": "text",
              "value": "\n    "
            },
            {
              "kind": "element",
              "name": "Item",
              "attributes": [
                {
                  "name": "id",
                  "value": "2"
                }
              ],
              "children": [
                {
                  "kind": "text",